742,900625884,GRUPO ALTEA SAS,SUPERSOCIEDADES,Antioquia,ANTIOQUIA,RIONEGRO,C2421 - Industrias básicas de metales preciosos,Manufactura,391940280,1829873,23483093,16241435,7241658,216503312,562648,32059718,26796396,5263322,40 NIIF Pymes - Individual Grupo 2
743,890211777,CONSTRUCCIONES MARVAL S.A.S,SUPERSOCIEDADES,Centro - Oriente,SANTANDER,BUCARAMANGA,F4111 - Construcción de edificios residenciales,Construccion ,391901997,65448468,1486512309,890696396,595815913,388348544,38074073,1377206361,846838916,530367445,10 NIIF Plenas - Individual Grupo 1
744,800120681,CROYDON COLOMBIA S.A,SUPERSOCIEDADES,Bogotá - Cundinamarca,BOGOTA D.C.,"BOGOTA, D.C.","C1522 - Fabricación de otros tipos de calzado, excepto calzado de cuero y piel",Manufactura,391708127,8276893,164882085,108475033,56407052,330330144,5112032,162817465,112760727,50056738,40 NIIF Pymes - Individual Grupo 2
745,890936071,AGROPECUARIA SAN FERNANDO S.A.S,SUPERSOCIEDADES,Antioquia,ANTIOQUIA,AMAGA,C3290 - Otras industrias manufactureras n.c.p.,Manufactura,391487391,20475335,318584400,174406180,144178220,286539808,22039657,239898521,108691566,131206955,50 NIIF Pymes - Separado Grupo 2
746,844004576,EMPRESA DE ENERGIA DE CASANARE SA ESP,SUPERSERVICIOS,Otros,CASANARE,YOPAL,"D3514 - Suministro de electricidad, gas, vapor y aire acondicionado",Servicios,390628438,14518495,308837632,123622917,185214715,331309276,10583589,286459620,115763400,170696220,
747,891900196,INGENIO CARMELITA SA ,SUPERSOCIEDADES,Costa Pacífica,VALLE DEL CAUCA,RIOFRIO,C1071 - Elaboración y refinación de azúcar,Manufactura,390337949,25548179,368707624,173050931,195656693,281314528,21305884,345887048,186314898,159572150,10 NIIF Plenas - Individual Grupo 1
748,800027813,INGEOMEGA S.A.S  ,SUPERSOCIEDADES,Antioquia,ANTIOQUIA,MEDELLIN,F4321 - Instalaciones eléctricas,Construccion ,390174079,16742493,159791404,86397286,73394118,312441760,15580779,117528442,59575551,57952891,40 NIIF Pymes - Individual Grupo 2
749,901261048,GRUPO UMA SAS,SUPERSOCIEDADES,Antioquia,ANTIOQUIA,MEDELLIN,"G4541 - Comercio de motocicletas y de sus partes, piezas y accesorios",Comercio,390084103,9384144,235142629,213669158,21473471,354771168,3348332,257693099,245603772,12089327,10 NIIF Plenas - Individual Grupo 1
750,823004536,COMUNICACIONES DEL CARIBE SAS,SUPERSOCIEDADES,Costa Atlántica,SUCRE,SINCELEJO-SUCRE,G4774 - Comercio al por menor de otros productos nuevos en establecimientos especializados,Comercio,389830379,13995331,104291685,33569270,70722415,472312960,19700855,132461209,75734125,56727084,40 NIIF Pymes - Individual Grupo 2
751,900158685,CENTURY SPORTS SAS,SUPERSOCIEDADES,Bogotá - Cundinamarca,BOGOTA D.C.,"BOGOTA, D.C.",G4771 - Comercio al por menor de prendas de vestir y sus accesorios (incluye artículos de piel) en establecimientos especializados,Comercio,389791250,20111404,525282498,425589004,99693494,378857069,28342026,514466865,417367711,97099154,10 NIIF Plenas - Individual Grupo 1
752,890916883,MANPOWER DE COLOMBIA LTDA  ,SUPERSOCIEDADES,Antioquia,ANTIOQUIA,ENVIGADO,N7820 - Actividades de empresas de servicios temporales,Servicios,389789265,1992899,72661558,34912053,37749505,429725856,5581627,80837679,45081073,35756606,10 NIIF Plenas - Individual Grupo 1
753,800208785,CONGELADOS AGRICOLAS SA CONGELAGRO SA ,SUPERSOCIEDADES,Bogotá - Cundinamarca,BOGOTA D.C.,"BOGOTA, D.C.","C1020 - Procesamiento y conservación de frutas, legumbres, hortalizas y tubérculos",Manufactura,389393117,17483069,175649981,73950099,101699882,316070912,12678374,147643749,63426936,84216813,20 NIIF Plenas - Separado Grupo 1
754,830513729,COMBUSTIBLES DE COLOMBIA SA ,SUPERSOCIEDADES,Costa Pacífica,VALLE DEL CAUCA,CALI,G4731 - Comercio al por menor de combustible para automotores,Comercio,389381537,13618436,130583415,55828095,74755320,343523552,8927889,144124630,74087746,70036884,40 NIIF Pymes - Individual Grupo 2
755,901044640,JORGE CORTES Y CIA SAS DISTRIBUIDORA DE VEHICULOS ,SUPERSOCIEDADES,Bogotá - Cundinamarca,BOGOTA D.C.,"BOGOTA, D.C.",G4511 - Comercio de vehículos automotores nuevos,Comercio,389169278,3862954,104427569,80528107,23899462,331010464,10747261,77000280,56891055,20109225,40 NIIF Pymes - Individual Grupo 2
756,800096040,COMESTIBLES ALDOR S.A.S.,SUPERSOCIEDADES,Costa Pacífica,VALLE DEL CAUCA,YUMBO,"C1082 - Elaboración de cacao, chocolate y productos de confitería",Manufactura,389147322,-676190,319806190,254237288,65568902,366182016,9432510,320189692,253793362,66396330,10 NIIF Plenas - Individual Grupo 1
757,800164767,GABRICA SAS ,SUPERSOCIEDADES,Bogotá - Cundinamarca,BOGOTA D.C.,"BOGOTA, D.C.",G4759 - Comercio al por menor de otros artículos domésticos en establecimientos especializados,Comercio,389020107,37239395,188895994,49990724,138905270,360178144,48409744,212519515,79852835,132666680,20 NIIF Plenas - Separado Grupo 1
758,830065842,Atento Colombia S.A.,SUPERSOCIEDADES,Bogotá - Cundinamarca,BOGOTA D.C.,"BOGOTA, D.C.",N8220 - Actividades de centros de llamadas (call center),Servicios,388434083,-21747547,182655226,154955864,27699362,405123744,-2227661,214926323,165425682,49500641,10 NIIF Plenas - Individual Grupo 1
759,860006656,FUNDACION ABOOD SHAIO,SUPERSALUD,Bogotá - Cundinamarca,BOGOTA D.C.,"BOGOTA, D.C.","Q8621 - Actividades de la práctica médica, sin internación",Servicios,388080749,33050481,630980000,78968000,552012000,314202225,8611147,615112881,96151396,518961485,GRUPO 2
760,892000501,HOSPITAL DEPARTAMENTAL DE VILLAVICENCIO E.S.E.,SUPERSALUD,Otros,META,VILLAVICENCIO,"Q8610 - Actividades de hospitales y clínicas, con internación",Servicios,388043252,28492170,287459799,78944718,208515081,284698703,7222871,245499134,65455416,180043718,CGN RES. 414/2014
761,900335279,INVERSIONES GLP SAS ESP,SUPERSERVICIOS,Bogotá - Cundinamarca,BOGOTA D.C.,"BOGOTA, D.C.","G4661 - Comercio al por mayor y en comisión o por contrata, excepto el comercio de vehículos automotores y motocicletas",Comercio,387823793,26586025,649380135,227197397,422182738,407426373,10884283,633608021,238132099,395475922,
762,900038232,CENTRAL TERMOELECTRICA EL MORRO 2 SAS ESP,SUPERSERVICIOS,Bogotá - Cundinamarca,BOGOTA D.C.,"BOGOTA, D.C.","D3511 - Suministro de electricidad, gas, vapor y aire acondicionado",Servicios,387819994,16606153,262599949,149416158,113183791,368328436,46117478,232864549,136286911,96577638,
763,890909001,EMPRESA DE DISTRIBUCIONES INDUSTRIALES S.A.S,SUPERTRANSPORTE,Antioquia,ANTIOQUIA,MEDELLIN,H4923 - Transporte terrestre; transporte por tuberías,Servicios,386657299.013,-16915743.121,205997973.35253,179749011.814,26248961.539,331861136.00699997,-8745541.787,233786904.779,190622200.121,43164704.658,GRUPO 1
764,890400372,RAFAEL DEL CASTILLO Y CIA SA,SUPERSOCIEDADES,Costa Atlántica,BOLIVAR,CARTAGENA,C1051 - Elaboración de productos de molinería,Manufactura,386643832,-13876612,207710688,156975312,50735376,394936032,8180193,244092739,175480751,68611988,10 NIIF Plenas - Individual Grupo 1
765,830094920,KMA CONSTRUCCIONES SAS,SUPERSOCIEDADES,Costa Atlántica,BOLIVAR,CARTAGENA,F4290 - Construcción de otras obras de ingeniería civil,Construccion ,386197232,34675442,1339878747,720260730,619618017,342613024,24695561,1260422325,691121625,569300700,20 NIIF Plenas - Separado Grupo 1
766,900136519,DASA DE COLOMBIA S A S,SUPERSOCIEDADES,Bogotá - Cundinamarca,CUNDINAMARCA,CAJICA,C1040 - Elaboración de productos lácteos,Manufactura,385449520,53061016,276126228,91591510,184534718,318821024,29986324,222759866,91286164,131473702,10 NIIF Plenas - Individual Grupo 1
767,805011262,RTS S.A.S,SUPERSALUD,Antioquia,ANTIOQUIA,MEDELLIN,Q8699 - Otras actividades de atención de la salud humana,Servicios,385413077,-5452258,286484000,146107000,140377000,342418082,615791,251855251,106025789,145829462,GRUPO 1
768,860013951,G4S SECURE SOLUTIONS COLOMBIA SA .,SUPERVIGILANCIA,Bogotá - Cundinamarca,BOGOTA D.C.,"BOGOTA, D.C.",N8010 - Actividades de seguridad privada,Servicios,385214733.331,9586488.786,162779803.337,94092835.212,68686968.125,337617985,10934121,120901972,61801493,59100479,GRUPO 1
769,860015118,CONTINAUTOS SAS,SUPERSOCIEDADES,Bogotá - Cundinamarca,BOGOTA D.C.,"BOGOTA, D.C.",G4511 - Comercio de vehículos automotores nuevos,Comercio,385178664,8558784,271042931,110638300,160404631,476395616,8083880,265563571,107933667,157629904,40 NIIF Pymes - Individual Grupo 2
770,860037900,CONSTRUCTORA BOLIVAR CALI SA,SUPERSOCIEDADES,Costa Pacífica,VALLE DEL CAUCA,CALI,F4111 - Construcción de edificios residenciales,Construccion ,384032823,5419821,1834214273,1437049890,397164383,306621216,65184392,1602197990,1202453428,399744562,20 NIIF Plenas - Separado Grupo 1
771,900396759,CHILCO DISTRIBUIDORA DE GAS Y ENERGIA SAS ESP,SUPERSERVICIOS,Bogotá - Cundinamarca,BOGOTA D.C.,"BOGOTA, D.C.","G4661 - Comercio al por mayor y en comisión o por contrata, excepto el comercio de vehículos automotores y motocicletas",Comercio,383278042,28854663,400478921,180650288,219828633,410670482,22573000,372741576,180242605,192498971,
772,900514524,ABBVIE S.A.S.,SUPERSOCIEDADES,Bogotá - Cundinamarca,BOGOTA D.C.,"BOGOTA, D.C.","G4645 - Comercio al por mayor de productos farmacéuticos, medicinales, cosméticos y de tocador",Comercio,382814807,-2974927,380418676,162186159,218232517,190534656,4123766,194181266,50034860,144146406,10 NIIF Plenas - Individual Grupo 1
773,860524007,INVERSIONES VENTURA GROUP S.A.,SUPERTRANSPORTE,Bogotá - Cundinamarca,BOGOTA D.C.,"BOGOTA, D.C.",H5224 - Almacenamiento y actividades complementarias al transporte,Servicios,382408578,10412081,392667515,256221070,136446445,380705613,39673765,334774792,197680090,137094702,GRUPO 1
774,900595161,Sacyr Concesiones Colombia S.A.S.  ,SUPERSOCIEDADES,Bogotá - Cundinamarca,BOGOTA D.C.,"BOGOTA, D.C.",F4210 - Construcción de carreteras y vías de ferrocarril,Construccion ,379898232,380013632,1707962123,105062631,1602899492,97539184,65011255,1666562868,327994891,1338567977,20 NIIF Plenas - Separado Grupo 1
775,901265237,CI GOLDLAND SAS,SUPERSOCIEDADES,Costa Atlántica,ATLANTICO,BARRANQUILLA,G4620 - Comercio al por mayor de materias primas agropecuarias; animales vivos,Comercio,379680360,2375750,39640190,33489431,6150759,301881536,2622143,46588287,43313278,3275009,10 NIIF Plenas - Individual Grupo 1
776,800249313,MANSAROVAR ENERGY COLOMBIA LTD,SUPERSOCIEDADES,Bogotá - Cundinamarca,BOGOTA D.C.,"BOGOTA, D.C.",B0610 - Extracción de petróleo crudo,Minero,379118804,53973995,493688372,566477689,-72789317,470418976,186724880,435208224,610666014,-175457790,10 NIIF Plenas - Individual Grupo 1
777,900291018,CLINICA LOS NOGALES SAS,SUPERSALUD,Bogotá - Cundinamarca,BOGOTA D.C.,"BOGOTA, D.C.","Q8610 - Actividades de hospitales y clínicas, con internación",Servicios,378969478,59766913,355556000,131815000,223741000,311158823,47959635,288300228,116998199,171302029,GRUPO 2
778,899999123,FUNDACION HOSPITAL DE LA MISERICORDIA,SUPERSALUD,Bogotá - Cundinamarca,BOGOTA D.C.,"BOGOTA, D.C.","Q8610 - Actividades de hospitales y clínicas, con internación",Servicios,378693974,95462586,783324000,62194000,721130000,295533921,60515742,668202789,60285335,607917454,GRUPO 2
779,890903295,SUPPLA S A,SUPERSOCIEDADES,Bogotá - Cundinamarca,BOGOTA D.C.,"BOGOTA, D.C.",H5210 - Almacenamiento y depósito,Servicios,377589989,13521795,346806177,229219057,117587120,356395488,-27460992,330737377,226208653,104528724,20 NIIF Plenas - Separado Grupo 1
780,830036921,VIDRIO ANDINO SAS,SUPERSOCIEDADES,Bogotá - Cundinamarca,CUNDINAMARCA,SOACHA,C2310 - Fabricación de vidrio y productos de vidrio,Manufactura,376874482,74721198,620500914,112801642,507699272,445243104,108586013,596267692,119855212,476412480,10 NIIF Plenas - Individual Grupo 1
781,890905032,PREBEL SA BIC,SUPERSOCIEDADES,Antioquia,ANTIOQUIA,MEDELLIN,"C2396 - Corte, tallado y acabado de la piedra",Manufactura,376198046,-5553665,275594242,127442860,148151382,355637760,7747598,242642817,88937771,153705046,50 NIIF Pymes - Separado Grupo 2
782,900103457,TCS SOLUTION CENTER SUCURSAL COLOMBIA,SUPERSOCIEDADES,Bogotá - Cundinamarca,BOGOTA D.C.,"BOGOTA, D.C.",J6202 - Actividades de consultoría informática y actividades de administración de instalaciones informáticas,Servicios,376028895,30408593,204576652,63529796,141046856,361293760,31050101,202020369,62874106,139146263,10 NIIF Plenas - Individual Grupo 1
783,901017237,VINCI CONSTRUCTION GRANDS PROJETS - SUCURSAL COLOMBIA,SUPERSOCIEDADES,Bogotá - Cundinamarca,BOGOTA D.C.,"BOGOTA, D.C.",F4210 - Construcción de carreteras y vías de ferrocarril,Construccion ,374575638,-3151325,611317492,352311560,259005932,145137488,-5221770,294734644,137042657,157691987,40 NIIF Pymes - Individual Grupo 2
784,900481902,COMERCIALIZADORA FRESMAR SAS  ,SUPERSOCIEDADES,Eje Cafetero,RISARALDA,DOS QUEBRADAS,"G4723 - Comercio al por menor de carnes (incluye aves de corral), productos cárnicos, pescados y productos de mar, en establecimientos especializados",Comercio,373783056,12166835,75815193,29215387,46599806,365310528,6417352,84198278,50197307,34000971,10 NIIF Plenas - Individual Grupo 1
785,900961809,VINCI CONSTRUCTION TERRASSEMENT GRANDS PROJETS SUCURSAL COLOMBIA,SUPERSOCIEDADES,Bogotá - Cundinamarca,BOGOTA D.C.,"BOGOTA, D.C.",F4290 - Construcción de otras obras de ingeniería civil,Construccion ,373648387,-4544679,609128225,354989682,254138543,145330448,-5823097,288701078,139331451,149369627,40 NIIF Pymes - Individual Grupo 2
786,900675169,COMBURED SAS,SUPERSOCIEDADES,Antioquia,ANTIOQUIA,MEDELLIN,G4731 - Comercio al por menor de combustible para automotores,Comercio,373603972,7654632,88227625,48966975,39260650,302415008,8329317,68130694,36524676,31606018,40 NIIF Pymes - Individual Grupo 2
787,811027319,SOCIEDAD DE COMERCIALIZACION INTERNACIONAL BANAFRUT S.A,SUPERSOCIEDADES,Antioquia,ANTIOQUIA,MEDELLIN,G4620 - Comercio al por mayor de materias primas agropecuarias; animales vivos,Comercio,372504821,3456318,188563852,160272655,28291197,278587872,254322,191376437,166541560,24834877,10 NIIF Plenas - Individual Grupo 1
788,900061516,MUEBLES JAMAR S.A.,SUPERSOCIEDADES,Costa Atlántica,ATLANTICO,BARRANQUILLA,"G4719 - Comercio al por menor en establecimientos no especializados, con surtido compuesto principalmente por productos diferentes de alimentos (víveres en general), bebidas (alcohólicas y no alcohólicas) y tabaco",Comercio,370972718,1201582,195165346,137631786,57533560,418844832,4823894,211545520,155213542,56331978,40 NIIF Pymes - Individual Grupo 2
789,900920562,CONCESION VIAS DEL NUS SAS,SUPERSOCIEDADES,Antioquia,ANTIOQUIA,MEDELLIN,F4210 - Construcción de carreteras y vías de ferrocarril,Construccion ,370677105,-10186466,1826184490,1743509846,82674644,250301456,-44279705,1676167624,1582092963,94074661,10 NIIF Plenas - Individual Grupo 1
790,830008524,BLU LOGISTICS COLOMBIA SAS,SUPERSOCIEDADES,Bogotá - Cundinamarca,BOGOTA D.C.,"BOGOTA, D.C.",H4923 - Transporte de carga por carretera,Servicios,370234329,-13346468,122051725,69426483,52625242,966088064,81862466,217803951,151832241,65971710,40 NIIF Pymes - Individual Grupo 2
791,890104719,Industrias Puropollo s.a.s.,SUPERSOCIEDADES,Costa Atlántica,ATLANTICO,BARRANQUILLA,A0145 - Cría de aves de corral,Agropecuario,369300236,3005101,184927564,165826861,19100703,347672800,293418,155335938,139055317,16280621,40 NIIF Pymes - Individual Grupo 2
792,890906413,ELECTRICAS DE MEDELLIN INGENIERIA Y SERVICIOS SAS,SUPERSOCIEDADES,Antioquia,ANTIOQUIA,MEDELLIN,F4220 - Construcción de proyectos de servicio público,Construccion ,368343536,42767069,1552670970,586894742,965776228,346901504,63583432,1349255619,446439560,902816059,20 NIIF Plenas - Separado Grupo 1
793,890110964,ALIMENTOS DEL VALLE S.A,SUPERSOCIEDADES,Costa Pacífica,CAUCA,CALOTO,C1040 - Elaboración de productos lácteos,Manufactura,368339259,10062238,138876312,81722530,57153782,302711936,3003748,127540418,77474555,50065863,40 NIIF Pymes - Individual Grupo 2
794,802007669,TRANSELCA S.A. E.S.P.,SUPERFINANCIERA,Costa Atlántica,ATLANTICO,BARRANQUILLA,D3512 - Transmision d energia electrica,Servicios,367544436,199451818,1936548365,1025967135,910581230,459834204,222944514,1788872759,785994980,1002877779,GRUPO 1
795,806009543,UFINET COLOMBIA S.A,SUPERSOCIEDADES,Bogotá - Cundinamarca,BOGOTA D.C.,"BOGOTA, D.C.",J6190 - Otras actividades de telecomunicaciones,Servicios,367218219,75961651,852222560,650681737,201540823,261004752,20414462,606323041,480743869,125579172,10 NIIF Plenas - Individual Grupo 1
796,860000580,MERCK S.A,SUPERSOCIEDADES,Bogotá - Cundinamarca,BOGOTA D.C.,"BOGOTA, D.C.","G4645 - Comercio al por mayor de productos farmacéuticos, medicinales, cosméticos y de tocador",Comercio,366044644,19756956,234491621,51494999,182996622,343097184,30944528,221636859,59288386,162348473,10 NIIF Plenas - Individual Grupo 1
797,860512466,SABANALAC SA,SUPERSOCIEDADES,Bogotá - Cundinamarca,CUNDINAMARCA,CAJICA,C1040 - Elaboración de productos lácteos,Manufactura,365733692,12153697,143618400,109426594,34191806,284918816,10182652,83726113,61874199,21851914,40 NIIF Pymes - Individual Grupo 2
798,800059030,AGRICOLA EL RETIRO SAS EN REORGANIZACION,SUPERSOCIEDADES,Antioquia,ANTIOQUIA,ENVIGADO,A0122 - Cultivo de plátano y banano,Agropecuario,364775347,-10566412,353870210,104217134,249653076,255158080,1023266,275071066,67277045,207794021,10 NIIF Plenas - Individual Grupo 1
799,901081311,PUNTOS COLOMBIA S.A.,SUPERSOCIEDADES,Antioquia,ANTIOQUIA,ENVIGADO,N8299 - Otras actividades de servicio de apoyo a las empresas n.c.p.,Servicios,364607188,-3055078,250310845,230338349,19972496,320325952,3825762,234615504,211587930,23027574,10 NIIF Plenas - Individual Grupo 1
800,901122402,SCOTIA GLOBAL BUSINESS SERVICES COLOMBIA ZONA FRANCA EMPRESARIAL S.A.S,SUPERSOCIEDADES,Bogotá - Cundinamarca,BOGOTA D.C.,"BOGOTA, D.C.",N8211 - Actividades combinadas de servicios administrativos de oficina,Servicios,364326010,13162476,312865736,162031033,150834703,351298880,16190472,290241379,152569152,137672227,10 NIIF Plenas - Individual Grupo 1
801,800114766,FRESKALECHE S.A.S,SUPERSOCIEDADES,Centro - Oriente,SANTANDER,BUCARAMANGA,C1040 - Elaboración de productos lácteos,Manufactura,363793355,6468746,118558021,78837452,39720569,334095232,8459847,86459084,44995776,41463308,20 NIIF Plenas - Separado Grupo 1
802,900403002,DNA DISTRINAL SAS,SUPERSOCIEDADES,Costa Pacífica,VALLE DEL CAUCA,CALI,G4631 - Comercio al por mayor de productos alimenticios,Comercio,363755083,5585006,146950749,122944259,24006490,403687808,2569546,95469996,77048513,18421483,40 NIIF Pymes - Individual Grupo 2
803,900239001,PRODUCTOS FAMILIA  CAJICA SAS,SUPERSOCIEDADES,Antioquia,ANTIOQUIA,MEDELLIN,C1709 - Fabricación de otros artículos de papel y cartón,Manufactura,363728043,81288991,363416006,70928987,292487019,341674848,76425490,291973955,80775927,211198028,10 NIIF Plenas - Individual Grupo 1
804,890900308,FABRICATO S.A,SUPERFINANCIERA,Antioquia,ANTIOQUIA,BELLO,C1312 - Tejeduria de productos textiles,Manufactura,361847000,-122512000,761492000,443586000,317906000,484258457,2235716,849487450,400633324,448854126,GRUPO 1
805,890800788,SUMATEC SAS BIC,SUPERSOCIEDADES,Eje Cafetero,CALDAS,MANIZALES,"G4663 - Comercio al por mayor de materiales de construcción, artículos de ferretería, pinturas, productos de vidrio, equipo y materiales de fontanería y calefacción",Comercio,361293875,3175053,218570459,186978257,31592202,350526304,8651340,221435960,183137775,38298185,50 NIIF Pymes - Separado Grupo 2
806,860514592,DEPOSITO PRINCIPAL DE DROGAS LTDA,SUPERSOCIEDADES,Bogotá - Cundinamarca,BOGOTA D.C.,"BOGOTA, D.C.","G4773 - Comercio al por menor de productos farmacéuticos y medicinales, cosméticos y artículos de tocador en establecimientos especializados",Comercio,361241884,5506793,241851298,208439545,33411753,344791008,3322921,229766960,201862000,27904960,50 NIIF Pymes - Separado Grupo 2
807,900203566,ABASTECEMOS DE OCCIDENTE SAS,SUPERSOCIEDADES,Costa Pacífica,VALLE DEL CAUCA,YUMBO,"G4711 - Comercio al por menor en establecimientos no especializados con surtido compuesto principalmente por alimentos, bebidas (alcohólicas y no alcohólicas) o tabaco",Comercio,361010349,5530200,76006877,34007963,41998914,319394432,5059097,68548685,30722924,37825761,40 NIIF Pymes - Individual Grupo 2
808,860023264,SECURITAS COLOMBIA SA,SUPERVIGILANCIA,Bogotá - Cundinamarca,BOGOTA D.C.,"BOGOTA, D.C.",N8010 - Actividades de seguridad privada,Servicios,360918594,4240072,105337346,61930632,43406714,296023280,10741780,98233061,58548977,39684084,GRUPO 1
809,900394791,Masivo Capital SAS En Reorganizacion,SUPERSOCIEDADES,Bogotá - Cundinamarca,BOGOTA D.C.,"BOGOTA, D.C.",H4921 - Transporte de pasajeros,Servicios,360542471,-9741159,678991094,655321702,23669392,314812448,-23706433,660813006,627402455,33410551,40 NIIF Pymes - Individual Grupo 2
810,830106920,LABORATORIOS BIOPAS SA,SUPERSOCIEDADES,Bogotá - Cundinamarca,BOGOTA D.C.,"BOGOTA, D.C.","G4645 - Comercio al por mayor de productos farmacéuticos, medicinales, cosméticos y de tocador",Comercio,360077897,9336275,223950456,123332802,100617654,318792544,8400250,203882441,112601062,91281379,20 NIIF Plenas - Separado Grupo 1
811,890106814,GRANOS Y CEREALES DE COLOMBIA SA,SUPERSOCIEDADES,Costa Atlántica,ATLANTICO,SOLEDAD,C1051 - Elaboración de productos de molinería,Manufactura,357416725,9461826,261616414,165479651,96136763,328950560,23398159,240194980,155824398,84370582,20 NIIF Plenas - Separado Grupo 1
812,901109174,FRUBANA SAS,SUPERSOCIEDADES,Bogotá - Cundinamarca,BOGOTA D.C.,"BOGOTA, D.C.",G4631 - Comercio al por mayor de productos alimenticios,Comercio,357368373,-104094025,66253238,44694303,21558935,254941440,-98880964,57208841,28431683,28777158,10 NIIF Plenas - Individual Grupo 1
813,800090890,NUTRIMENTI DE COLOMBIA SAS,SUPERSOCIEDADES,Antioquia,ANTIOQUIA,MEDELLIN,"C1020 - Procesamiento y conservación de frutas, legumbres, hortalizas y tubérculos",Manufactura,356129684,-15113464,360910852,273738274,87172578,280123840,-19163505,324921222,312635180,12286042,10 NIIF Plenas - Individual Grupo 1
814,830050228,ADECCO SERVICIOS COLOMBIA S.A,SUPERSOCIEDADES,Bogotá - Cundinamarca,BOGOTA D.C.,"BOGOTA, D.C.",N7830 - Otras actividades de provisión de talento humano,Servicios,355949473,5125144,97537572,71341429,26196143,362442560,-1038580,95645869,74574870,21070999,10 NIIF Plenas - Individual Grupo 1
815,830007691,SOLETANCHE BACHY COLOMBIA SAS,SUPERSOCIEDADES,Bogotá - Cundinamarca,BOGOTA D.C.,"BOGOTA, D.C.",F4390 - Otras actividades especializadas para la construcción de edificios y obras de ingeniería civil,Construccion ,355760720,-664376,298064299,206491265,91573034,322876224,3039538,317377676,226043518,91334158,20 NIIF Plenas - Separado Grupo 1
816,860002274,ETERNA S A,SUPERSOCIEDADES,Bogotá - Cundinamarca,BOGOTA D.C.,"BOGOTA, D.C.",C2219 - Fabricación de formas básicas de caucho y otros productos de caucho n.c.p.,Manufactura,355086395,12657313,431789344,335097563,96691781,271106368,-1197985,357929350,273607028,84322322,20 NIIF Plenas - Separado Grupo 1
817,860508392,SERVIOPTICA SAS,SUPERSOCIEDADES,Bogotá - Cundinamarca,BOGOTA D.C.,"BOGOTA, D.C.","C3250 - Fabricación de instrumentos, aparatos y materiales médicos y odontológicos (incluido mobiliario)",Manufactura,354892092,15563307,233076446,93686485,139389961,236732208,-1659381,174868112,105323740,69544372,10 NIIF Plenas - Individual Grupo 1
818,900819727,PES COLOMBIA SAS,SUPERSOCIEDADES,Bogotá - Cundinamarca,CUNDINAMARCA,COTA,N8299 - Otras actividades de servicio de apoyo a las empresas n.c.p.,Servicios,354300881,144142,147347197,94926394,52420803,353409408,47060178,197922225,145645564,52276661,50 NIIF Pymes - Separado Grupo 2
819,800116871,C.I.IMPORTEX S.A.,SUPERSOCIEDADES,Bogotá - Cundinamarca,BOGOTA D.C.,"BOGOTA, D.C.",G4669 - Comercio al por mayor de otros productos n.c.p.,Comercio,354160549,15143352,112733188,91015577,21717611,427290976,13450060,162112921,147740410,14372511,10 NIIF Plenas - Individual Grupo 1
820,830511110,SKF Latin Trade SAS,SUPERSOCIEDADES,Bogotá - Cundinamarca,BOGOTA D.C.,"BOGOTA, D.C.",G4659 - Comercio al por mayor de otros tipos de maquinaria y equipo n.c.p.,Comercio,353281980,3488102,142362470,86849511,55512959,327015136,14622108,151899268,96846246,55053022,10 NIIF Plenas - Individual Grupo 1
821,860076820,POLLO ANDINO SA,SUPERSOCIEDADES,Bogotá - Cundinamarca,BOGOTA D.C.,"BOGOTA, D.C.",A0145 - Cría de aves de corral,Agropecuario,353060996,16352775,189575126,71534038,118041088,322231680,15857959,173728446,72067112,101661334,40 NIIF Pymes - Individual Grupo 2
822,901126410,PROYECTOS DE INVERSIÓN VIAL DEL ORIENTE S.A.S.,SUPERSOCIEDADES,Bogotá - Cundinamarca,BOGOTA D.C.,"BOGOTA, D.C.",F4210 - Construcción de carreteras y vías de ferrocarril,Construccion ,351972920,68011588,252565369,295066605,-42501236,292005760,-117786135,256456149,366968973,-110512824,10 NIIF Plenas - Individual Grupo 1
823,800186228,Ingenieria de vias sas,SUPERSOCIEDADES,Bogotá - Cundinamarca,BOGOTA D.C.,"BOGOTA, D.C.",F4210 - Construcción de carreteras y vías de ferrocarril,Construccion ,351214647,1047699,541263302,373376814,167886488,347911392,1318099,493923219,374630431,119292788,20 NIIF Plenas - Separado Grupo 1
824,830131993,EFECTIVO LTDA,SUPERSOCIEDADES,Bogotá - Cundinamarca,BOGOTA D.C.,"BOGOTA, D.C.",N8299 - Otras actividades de servicio de apoyo a las empresas n.c.p.,Servicios,350686512,23329815,399417768,269713799,129703969,437000576,28043781,466365339,314201546,152163793,40 NIIF Pymes - Individual Grupo 2
825,830021253,Crown Colombiana S.A.,SUPERSOCIEDADES,Bogotá - Cundinamarca,CUNDINAMARCA,TOCANCIPA,C2599 - Fabricación de otros productos elaborados de metal n.c.p.,Manufactura,350526718,39816818,275855051,134144155,141710896,464492448,62214276,388075384,223967030,164108354,10 NIIF Plenas - Individual Grupo 1
