495,900809229,HALEON COLOMBIA S.A.S,SUPERSOCIEDADES,Bogotá - Cundinamarca,BOGOTA D.C.,"BOGOTA, D.C.","G4645 - Comercio al por mayor de productos farmacéuticos, medicinales, cosméticos y de tocador",Comercio,600464814,35448818,303447722,184849712,118598010,640034496,11328342,287635336,180021808,107613528,10 NIIF Plenas - Individual Grupo 1
496,809000555,DIANA AGRICOLA SAS,SUPERSOCIEDADES,Bogotá - Cundinamarca,BOGOTA D.C.,"BOGOTA, D.C.",G4620 - Comercio al por mayor de materias primas agropecuarias; animales vivos,Comercio,597012444,2849529,364899889,283823200,81076689,517905504,13654285,360720020,283964717,76755303,10 NIIF Plenas - Individual Grupo 1
497,800093117,ARQUITECTURA Y CONCRETO SASNO,SUPERSOCIEDADES,Antioquia,ANTIOQUIA,MEDELLIN,F4111 - Construcción de edificios residenciales,Construccion ,596761664,31432514,2453410571,1481549973,971860598,678422528,97304374,2465686387,1499690828,965995559,20 NIIF Plenas - Separado Grupo 1
498,800200598,PRODESA Y CIA S.A. ,SUPERSOCIEDADES,Bogotá - Cundinamarca,BOGOTA D.C.,"BOGOTA, D.C.",F4111 - Construcción de edificios residenciales,Construccion ,596584929,8834981,1227154737,1077365435,149789302,561361536,17987242,1027237278,876422444,150814834,10 NIIF Plenas - Individual Grupo 1
499,802019339,ADAMA ANDINA B.V. SUCURSAL COLOMBIA,SUPERSOCIEDADES,Costa Atlántica,ATLANTICO,BARRANQUILLA,C2021 - Fabricación de plaguicidas y otros productos químicos de uso agropecuario,Manufactura,596274532,24728149,781400584,516480662,264919922,832740288,34880587,1135676441,895484669,240191772,10 NIIF Plenas - Individual Grupo 1
500,800156044,COMPAÑIA DE PUERTOS ASOCIADOS S.A.,SUPERTRANSPORTE,Bogotá - Cundinamarca,BOGOTA D.C.,"BOGOTA, D.C.",H5222 - Almacenamiento y actividades complementarias al transporte,Servicios,595791558.572,170007055.676,1214872236.474,800873933.368,413998303.106,581194212.156,-103047757.633,1325876714.376,1056962604.638,268914109.738,GRUPO 2
501,901007478,GRUPO ENERGÉTICO DE LAS AMERICAS SAS ESP,SUPERSERVICIOS,Costa Atlántica,ATLANTICO,BARRANQUILLA,"G4661 - Comercio al por mayor y en comisión o por contrata, excepto el comercio de vehículos automotores y motocicletas",Comercio,594761085,4713223,110831400,102038553,8792847,281633212,2528545,107155664,101506010,5649654,
502,890300554,C.I.  DE AZUCARES Y MIELES S.A.,SUPERTRANSPORTE,Costa Pacífica,VALLE DEL CAUCA,CALI,"G4631 - Comercio al por mayor y en comisión o por contrata, excepto el comercio de vehículos automotores y motocicletas",Comercio,592407089,-20973013,383286228,254641867,128644361,782580092,1461454,365683872,244119769,121564103,GRUPO 1
503,830083619,REPSOL COLOMBIA OIL & GAS LIMITED,SUPERSOCIEDADES,Bogotá - Cundinamarca,BOGOTA D.C.,"BOGOTA, D.C.",B0610 - Extracción de petróleo crudo,Minero,590219632,290025476,1325643833,306173238,1019470595,622258432,253879333,1084935491,247521010,837414481,10 NIIF Plenas - Individual Grupo 1
504,806001822,SACSA,SUPERTRANSPORTE,Costa Atlántica,BOLIVAR,CARTAGENA,H5223 - Almacenamiento y actividades complementarias al transporte,Servicios,586013424,9171232,109251806,64890214,44361592,512744342,11266777,101257161,66066801,35190360,GRUPO 1
505,901111609,NAPLES PRIME SAS CI,SUPERSOCIEDADES,Bogotá - Cundinamarca,BOGOTA D.C.,"BOGOTA, D.C.",G4662 - Comercio al por mayor de metales y productos metalíferos,Comercio,586000543,1957165,32610079,17985632,14624447,355033920,1916249,28526178,13358896,15167282,40 NIIF Pymes - Individual Grupo 2
506,900311581,MAC CENTER COLOMBIA SAS,SUPERSOCIEDADES,Bogotá - Cundinamarca,BOGOTA D.C.,"BOGOTA, D.C.","G4741 - Comercio al por menor de computadores, equipos periféricos, programas de informática y equipos de telecomunicaciones en establecimientos especializados",Comercio,585674619,4308111,209352112,178818730,30533382,473759808,8152566,180206018,155908748,24297270,10 NIIF Plenas - Individual Grupo 1
507,860511458,AGROINTEGRAL ANDINA SAS ,SUPERSOCIEDADES,Bogotá - Cundinamarca,CUNDINAMARCA,COTA,"G4664 - Comercio al por mayor de productos químicos básicos, cauchos y plásticos en formas primarias y productos químicos de uso agropecuario",Comercio,585583472,12691685,361707033,237118818,124588215,624426240,22849756,359849798,247966256,111883542,10 NIIF Plenas - Individual Grupo 1
508,890930545,MINCIVIL S.A.,SUPERSOCIEDADES,Bogotá - Cundinamarca,BOGOTA D.C.,"BOGOTA, D.C.",F4290 - Construcción de otras obras de ingeniería civil,Construccion ,584717090,21882963,1081064634,519174142,561890492,699473280,183841755,1041434619,494751255,546683364,50 NIIF Pymes - Separado Grupo 2
509,817001644,GENFAR SA,SUPERSOCIEDADES,Bogotá - Cundinamarca,BOGOTA D.C.,"BOGOTA, D.C.","G4645 - Comercio al por mayor de productos farmacéuticos, medicinales, cosméticos y de tocador",Comercio,583354760,47296812,338389382,130426467,207962915,492466944,61474559,309605009,151838804,157766205,10 NIIF Plenas - Individual Grupo 1
510,890805267,SUPER DE ALIMENTOS SAS,SUPERSOCIEDADES,Eje Cafetero,CALDAS,MANIZALES,"C1082 - Elaboración de cacao, chocolate y productos de confitería",Manufactura,582930365,-7513919,318594895,248653698,69941197,570621632,22895588,323155749,245250633,77905116,40 NIIF Pymes - Individual Grupo 2
511,860009876,KLM CIA REAL HOLANDESA DE AVIACION,SUPERTRANSPORTE,Bogotá - Cundinamarca,BOGOTA D.C.,"BOGOTA, D.C.",H5112 - Transporte aéreo,Servicios,582822431.048,0,19295879.091,19185879.091,110000,594905190.966,0,8636796.756,8526796.756,110000,GRUPO 1
512,830069311,NABORS DRILLING INTERNATIONAL LTD. BERMUDA,SUPERSOCIEDADES,Bogotá - Cundinamarca,BOGOTA D.C.,"BOGOTA, D.C.",B0910 - Actividades de apoyo para la extracción de petróleo y de gas natural,Minero,581347805,100434396,629513861,121272056,508241805,601450368,65239758,960922574,234300711,726621863,10 NIIF Plenas - Individual Grupo 1
513,830080672,CEPSA COLOMBIA SA,SUPERSOCIEDADES,Bogotá - Cundinamarca,BOGOTA D.C.,"BOGOTA, D.C.",B0610 - Extracción de petróleo crudo,Minero,579078837,134366762,2783611206,259485230,2524125976,768340352,388972821,3580632418,558890136,3021742282,10 NIIF Plenas - Individual Grupo 1
514,860016640,TCC S.A.S,SUPERTRANSPORTE,Antioquia,ANTIOQUIA,MEDELLIN,H4923 - Transporte terrestre; transporte por tuberías,Servicios,576678542.0439999,7228182.558,431698999.408,188165731.882,243533267.526,523779907.55999994,17333214.908,403494609.841,165372799.802,238121810.039,GRUPO 1
515,805018495,CERDOS DEL VALLE SA,SUPERSOCIEDADES,Costa Pacífica,VALLE DEL CAUCA,YUMBO,A0144 - Cría de ganado porcino,Agropecuario,575643002,3806522,293972250,268606186,25366064,476947872,3666307,207098861,185339319,21759542,10 NIIF Plenas - Individual Grupo 1
516,890903474,ENKA DE COLOMBIA S A,SUPERFINANCIERA,Antioquia,ANTIOQUIA,MEDELLIN,C2030 - Fabricacion de fibras sinteticas y artificiales,Manufactura,574397000,20049000,695695000,181076000,514619000,595914666,24645262,808085527,327222521,480863006,GRUPO 1
517,830036108,SED INTERNATIONAL DE COLOMBIA S A S,SUPERSOCIEDADES,Bogotá - Cundinamarca,CUNDINAMARCA,TOCANCIPA,"G4651 - Comercio al por mayor de computadores, equipo periférico y programas de informática",Comercio,573155608,9025704,210170168,151204037,58966131,562599424,12366983,183247627,133307200,49940427,10 NIIF Plenas - Individual Grupo 1
518,800212840,L’ORÉAL COLOMBIA S. A. S.,SUPERSOCIEDADES,Bogotá - Cundinamarca,BOGOTA D.C.,"BOGOTA, D.C.","G4645 - Comercio al por mayor de productos farmacéuticos, medicinales, cosméticos y de tocador",Comercio,572219977,4087481,502875687,267419294,235456393,410891680,5034728,437119551,217050426,220069125,20 NIIF Plenas - Separado Grupo 1
519,860015536,HOSPITAL UNIVERSITARIO SAN IGNACIO,SUPERSALUD,Bogotá - Cundinamarca,BOGOTA D.C.,"BOGOTA, D.C.","Q8610 - Actividades de hospitales y clínicas, con internación",Servicios,571071388,-409770,366807000,247297000,119510000,500054157,18372957,302379499,179023830,123355669,GRUPO 2
520,900276770,CNEOG COLOMBIA SUCURSAL COLOMBIA,SUPERSOCIEDADES,Bogotá - Cundinamarca,BOGOTA D.C.,"BOGOTA, D.C.",B0620 - Extracción de gas natural,Minero,570578060,382789156,3665239524,476632171,3188607353,25723244,-65142462,3818646932,97273993,3721372939,10 NIIF Plenas - Individual Grupo 1
521,890303093,COMFENALCO VALLE,SUPERSALUD,Costa Pacífica,VALLE DEL CAUCA,CALI,O8430 - Actividades de planes de seguridad social de afiliación obligatoria,Servicios,568951592,-11053006,116259139,182141964,-65882825,570582817,-1405654,126029479,146650303,-20620824,GRUPO 2
522,900149606,EXCAVACIONES Y PROYECTOS DE COLOMBIA SAS,SUPERSOCIEDADES,Bogotá - Cundinamarca,BOGOTA D.C.,"BOGOTA, D.C.",B0990 - Actividades de apoyo para otras actividades de explotación de minas y canteras,Minero,568021572,20758604,249091313,60525296,188566017,479605952,55826106,274963276,85188440,189774836,40 NIIF Pymes - Individual Grupo 2
523,860026759,CARTONES AMERICA S.A. CAME,SUPERSOCIEDADES,Costa Pacífica,VALLE DEL CAUCA,CALI,"C1702 - Fabricación de papel y cartón ondulado (corrugado); fabricación de envases, empaques y de embalajes de papel y cartón",Manufactura,567278225,115073807,579765888,328744986,251020902,605338040,143270296,634579638,384229481,250350157,20 NIIF Plenas - Separado Grupo 1
524,901180357,Osprey Metals S.A.S,SUPERSOCIEDADES,Antioquia,ANTIOQUIA,RIONEGRO,C2421 - Industrias básicas de metales preciosos,Manufactura,567262867,1346906,29471312,26318284,3153028,717665472,-1776084,73248878,71440786,1808092,10 NIIF Plenas - Individual Grupo 1
525,800007955,COMMERK SAS,SUPERSOCIEDADES,Costa Pacífica,VALLE DEL CAUCA,CANDELARIA,G4632 - Comercio al por mayor de bebidas y tabaco,Comercio,562970353,36185181,284759666,187440304,97319362,635534976,38410384,332398793,206449863,125948930,50 NIIF Pymes - Separado Grupo 2
526,811010485,FGA FONDO DE GARANTIAS S.A.,SUPERSOCIEDADES,Antioquia,ANTIOQUIA,MEDELLIN,K6619 - Otras actividades auxiliares de las actividades de servicios financieros n.c.p.,Servicios,562437714,76793268,500204556,241972231,258232325,535574368,42093802,474769560,291436281,183333279,10 NIIF Plenas - Individual Grupo 1
527,900907364,Empresa Colombiana de Cementos S.A.S,SUPERSOCIEDADES,Antioquia,ANTIOQUIA,SABANETA,"C2394 - Fabricación de cemento, cal y yeso",Manufactura,560597656,60543337,923357224,395799223,527558001,494349056,48813174,939659536,447926200,491733336,10 NIIF Plenas - Individual Grupo 1
528,890205645,MARVAL S.A.S,SUPERSOCIEDADES,Centro - Oriente,SANTANDER,BUCARAMANGA,F4111 - Construcción de edificios residenciales,Construccion ,560481394,98888329,2129057512,1374819906,754237606,681926784,123485704,1917921412,1187553516,730367896,20 NIIF Plenas - Separado Grupo 1
529,800012375,QBCO SAS,SUPERSOCIEDADES,Costa Pacífica,VALLE DEL CAUCA,BUGA,C1032 - Elaboración de aceites y grasas de origen vegetal refinados,Manufactura,558412847,9771899,460191195,338488978,121702217,656625664,17858228,533430404,402114824,131315580,20 NIIF Plenas - Separado Grupo 1
530,891401705,INGENIO RISARALDA S.A,SUPERSOCIEDADES,Eje Cafetero,RISARALDA,PEREIRA,C1071 - Elaboración y refinación de azúcar,Manufactura,557102027,30720845,595948210,333065401,262882809,532024704,50729739,562522631,331945563,230577068,20 NIIF Plenas - Separado Grupo 1
531,800084048,SOCIEDAD PORTUARIA TERMINAL DE CONTENEDORES DE BUENAVENTURA S.A.,SUPERTRANSPORTE,Costa Pacífica,VALLE DEL CAUCA,BUENAVENTURA,H5222 - Almacenamiento y actividades complementarias al transporte,Servicios,556951702,5721167,1196019519,667134433,528885086,599392348,30439687,1454362123,782009524,672352599,GRUPO 1
532,900334431,TERMONORTE SAS ESP,SUPERSERVICIOS,Bogotá - Cundinamarca,BOGOTA D.C.,"BOGOTA, D.C.","D3511 - Suministro de electricidad, gas, vapor y aire acondicionado",Servicios,554637107,183532140,416682325,150499768,266182557,380132751,110109853,370871015,240419146,130451869,
533,811029525,PRODUCTOS LACTEOS AURA S.A.S.,SUPERSOCIEDADES,Antioquia,ANTIOQUIA,RETIRO,C1040 - Elaboración de productos lácteos,Manufactura,553968981,28666417,254750456,199565553,55184903,448487296,26260403,209995753,157183199,52812554,20 NIIF Plenas - Separado Grupo 1
534,900843898,Rappi SAS,SUPERSOCIEDADES,Bogotá - Cundinamarca,BOGOTA D.C.,"BOGOTA, D.C.","J6201 - Actividades de desarrollo de sistemas informáticos (planificación, análisis, diseño, programación, pruebas)",Servicios,553247740,-5145204,453140756,397518688,55622068,357825120,-199461499,452506971,414879886,37627085,10 NIIF Plenas - Individual Grupo 1
535,901453880,KYNDRYL COLOMBIA SAS ,SUPERSOCIEDADES,Bogotá - Cundinamarca,BOGOTA D.C.,"BOGOTA, D.C.",J6202 - Actividades de consultoría informática y actividades de administración de instalaciones informáticas,Servicios,553200254,8541859,387803170,204547193,183255977,502575456,19111096,357068766,182354648,174714118,10 NIIF Plenas - Individual Grupo 1
536,890105927,C.I FARMACAPSULAS S.A.S,SUPERSOCIEDADES,Costa Atlántica,ATLANTICO,BARRANQUILLA,"C2100 - Fabricación de productos farmacéuticos, sustancias químicas medicinales y productos botánicos de uso farmacéutico",Manufactura,552364511,39013827,589696135,345795102,243901033,503248096,25256925,590176632,385289428,204887204,10 NIIF Plenas - Individual Grupo 1
537,900117087,BIOCOMBUSTIBLES SOSTENIBLES DEL CARIBE S.A. USUARIO OPERADOR DE ZONA FRANCA ,SUPERSOCIEDADES,Costa Atlántica,MAGDALENA,SANTA MARTA,C1032 - Elaboración de aceites y grasas de origen vegetal refinados,Manufactura,552092246,19687833,362951839,314987780,47964059,747682368,56962557,322565307,235289081,87276226,40 NIIF Pymes - Individual Grupo 2
538,900540901,CI LCC SAS,SUPERSOCIEDADES,Costa Atlántica,ATLANTICO,BARRANQUILLA,"G4661 - Comercio al por mayor de combustibles sólidos, líquidos, gaseosos y productos conexos",Comercio,550666374,4215777,219418094,204898305,14519789,434131904,1360675,179178684,168874673,10304011,40 NIIF Pymes - Individual Grupo 2
539,901429936,RAMEDICAS SAS ,SUPERSOCIEDADES,Centro - Oriente,SANTANDER,BUCARAMANGA,"G4645 - Comercio al por mayor de productos farmacéuticos, medicinales, cosméticos y de tocador",Comercio,549884775,39789542,251318858,156827770,94491088,434437216,25770285,181840289,127138743,54701546,10 NIIF Plenas - Individual Grupo 1
540,801004045,DON POLLO S.A.S,SUPERSOCIEDADES,Eje Cafetero,QUINDIO,ARMENIA,C1011 - Procesamiento y conservación de carne y productos cárnicos,Manufactura,549709774,20667029,297458973,221584689,75874284,441455552,11822974,231666643,196813996,34852647,20 NIIF Plenas - Separado Grupo 1
541,830029703,RCN TELEVISION S A,SUPERFINANCIERA,Bogotá - Cundinamarca,BOGOTA D.C.,"BOGOTA, D.C.",J6020 - Actividades de programación y transmisión de televisión,Servicios,549627289,-37641771,732019012,510253249,221765763,489265199,-26987628,770268920,506186883,264082037,GRUPO 1
542,900522508,INVERSIONES SUPERVAQUITA LA 33 S A S,SUPERSOCIEDADES,Antioquia,ANTIOQUIA,MEDELLIN,"G4711 - Comercio al por menor en establecimientos no especializados con surtido compuesto principalmente por alimentos, bebidas (alcohólicas y no alcohólicas) o tabaco",Comercio,549349479,12996146,183048023,108088963,74959060,454910784,13506622,114212203,52249289,61962914,40 NIIF Pymes - Individual Grupo 2
543,837000084,ips indígena mallamás,SUPERSALUD,Costa Pacífica,NARIÑO,IPIALES,O8430 - Actividades de planes de seguridad social de afiliación obligatoria,Servicios,549054656,-83748720,27021790,254683417,-227661627,442051433,-113021662,23943360,167856266,-143912906,CGN RES. 414/2014
544,890900518,FUNDACION HOSPITALARIA SAN VICENTE DE PAUL,SUPERSALUD,Antioquia,ANTIOQUIA,MEDELLIN,"Q8610 - Actividades de hospitales y clínicas, con internación",Servicios,547707658,19137525,409845000,205633000,204212000,428131794,11660187,393972598,210012595,183960003,GRUPO 1
545,890322007,QUIMPAC DE COLOMBIA SA,SUPERSOCIEDADES,Costa Pacífica,VALLE DEL CAUCA,PALMIRA,C2011 - Fabricación de sustancias y productos químicos básicos,Manufactura,547052273,65272983,586801633,347111953,239689680,637515748,81171440,654611039,481421462,173189577,20 NIIF Plenas - Separado Grupo 1
546,830113831,COLMEDICA EPS CENTRO MEDICO BOLIVIA,SUPERSALUD,Bogotá - Cundinamarca,BOGOTA D.C.,"BOGOTA, D.C.",O8430 - Actividades de planes de seguridad social de afiliación obligatoria,Servicios,546063885,7146910,202030199,142267649,59762550,502735910,17468176,188726644,120229237,68497407,GRUPO 1
547,900079775,Golosinas Trululu S.A ,SUPERSOCIEDADES,Eje Cafetero,CALDAS,MANIZALES,"C1082 - Elaboración de cacao, chocolate y productos de confitería",Manufactura,545799209,3688392,635861303,426488020,209373283,484243840,54631450,681764383,476079492,205684891,40 NIIF Pymes - Individual Grupo 2
548,890903310,ANHIDRIDOS Y DERIVADOS DE COLOMBIA S.A.S. ANDERCOL,SUPERSOCIEDADES,Antioquia,ANTIOQUIA,MEDELLIN,C2011 - Fabricación de sustancias y productos químicos básicos,Manufactura,545525251,35158913,393024530,194490295,198534235,661773952,29584862,431628623,249893388,181735235,20 NIIF Plenas - Separado Grupo 1
549,860002693,3M COLOMBIA S.A.,SUPERSOCIEDADES,Bogotá - Cundinamarca,BOGOTA D.C.,"BOGOTA, D.C.",G4669 - Comercio al por mayor de otros productos n.c.p.,Comercio,543325580,4244834,331476138,191839238,139636900,555279488,36013540,309541669,173870162,135671507,10 NIIF Plenas - Individual Grupo 1
550,830507278,GLORIA COLOMBIA S.A.S,SUPERSOCIEDADES,Bogotá - Cundinamarca,BOGOTA D.C.,"BOGOTA, D.C.",C1040 - Elaboración de productos lácteos,Manufactura,539742383,-21511668,320345059,194712795,125632264,503007072,-31609822,280383585,259230728,21152857,20 NIIF Plenas - Separado Grupo 1
551,890925108,PAPELES Y CARTONES S.A,SUPERSOCIEDADES,Antioquia,ANTIOQUIA,BARBOSA,"C1702 - Fabricación de papel y cartón ondulado (corrugado); fabricación de envases, empaques y de embalajes de papel y cartón",Manufactura,539392213,114010757,689338249,163352641,525985608,495444512,92327736,621771623,115108588,506663035,20 NIIF Plenas - Separado Grupo 1
552,890801339,MANISOL SAS,SUPERSOCIEDADES,Eje Cafetero,CALDAS,MANIZALES,G4772 - Comercio al por menor de todo tipo de calzado y artículos de cuero y sucedáneos del cuero en establecimientos especializados,Comercio,536372447,12196157,314612916,233664680,80948236,507137440,6472535,351321706,265774217,85547489,10 NIIF Plenas - Individual Grupo 1
553,860031028,"SIEMENS SOCIEDAD POR ACCIONES SIMPLIFICADA
s",SUPERSOCIEDADES,Bogotá - Cundinamarca,CUNDINAMARCA,TENJO,C2790 - Fabricación de otros tipos de equipo eléctrico n.c.p.,Manufactura,536295775,26526350,431778794,229443834,202334960,561384704,3977367,460034057,281756116,178277941,10 NIIF Plenas - Individual Grupo 1
554,800100159,COMPAÑIA DE COSMETICOS VOTRE PASSION SAS,SUPERSOCIEDADES,Antioquia,ANTIOQUIA,MEDELLIN,G4771 - Comercio al por menor de prendas de vestir y sus accesorios (incluye artículos de piel) en establecimientos especializados,Comercio,535933320,2701155,70085739,55776368,14309371,515552992,4224316,65419841,53811624,11608217,40 NIIF Pymes - Individual Grupo 2
555,817003055,TECNOFAR TQ S.A.S.,SUPERSOCIEDADES,Costa Pacífica,CAUCA,SANTANDER DE QUILICHAO,"C2100 - Fabricación de productos farmacéuticos, sustancias químicas medicinales y productos botánicos de uso farmacéutico",Manufactura,535686412,100461608,801318352,91605624,709712728,531696704,151217581,713116802,119124266,593992536,20 NIIF Plenas - Separado Grupo 1
556,900040299,ATLANTIC FS SAS,SUPERSOCIEDADES,Antioquia,ANTIOQUIA,MEDELLIN,"G4723 - Comercio al por menor de carnes (incluye aves de corral), productos cárnicos, pescados y productos de mar, en establecimientos especializados",Comercio,528228558,18438693,176075151,88550054,87525097,482908000,17401418,186895667,115086829,71808838,20 NIIF Plenas - Separado Grupo 1
557,800067065,PROMOTORA MEDICA LAS AMERICAS S.A,SUPERSALUD,Antioquia,ANTIOQUIA,MEDELLIN,"Q8610 - Actividades de hospitales y clínicas, con internación",Servicios,528182435,17754059,857745000,562910000,294835000,390981585,-33816721,733036816,458038670,274998146,GRUPO 1
558,899999092,INSTITUTO NACIONAL DE CANCEROLOGIA,SUPERSALUD,Bogotá - Cundinamarca,BOGOTA D.C.,"BOGOTA, D.C.","Q8621 - Actividades de la práctica médica, sin internación",Servicios,527305223,177598297,695489215,73288652,622200563,388832229,14496673,469397126,24794860,444602266,CGN RES. 414/2014
559,891501133,INGENIO LA CABAÑA S.A. ,SUPERSOCIEDADES,Costa Pacífica,VALLE DEL CAUCA,CALI,C1071 - Elaboración y refinación de azúcar,Manufactura,525785978,-68425641,1422656875,876534886,546121989,624181888,-10822418,1369668940,756024718,613644222,20 NIIF Plenas - Separado Grupo 1
560,860028601,FINANZAUTO S.A. BIC,SUPERSOCIEDADES,Bogotá - Cundinamarca,BOGOTA D.C.,"BOGOTA, D.C.",K6619 - Otras actividades auxiliares de las actividades de servicios financieros n.c.p.,Servicios,525771553,54298897,2076905373,1488298104,588607269,343422432,52059695,1685975598,1171327780,514647818,20 NIIF Plenas - Separado Grupo 1
561,860525060,SOCIEDAD EXPORTADORA DE CAFE DE LAS COOPERATIVAS DE CAFICULTORES S A EXPOCAFE S.A.,SUPERSOCIEDADES,Bogotá - Cundinamarca,BOGOTA D.C.,"BOGOTA, D.C.",G4620 - Comercio al por mayor de materias primas agropecuarias; animales vivos,Comercio,524985724,1462365,156886564,146166494,10720070,661851264,3702972,193456563,186188304,7268259,20 NIIF Plenas - Separado Grupo 1
562,900585053,TRAFIGURA ENERGY COLOMBIA SAS,SUPERSOCIEDADES,Bogotá - Cundinamarca,BOGOTA D.C.,"BOGOTA, D.C.","G4661 - Comercio al por mayor de combustibles sólidos, líquidos, gaseosos y productos conexos",Comercio,523944116,2905601,265590635,248417413,17173222,465484416,11584032,336373303,317991657,18381646,10 NIIF Plenas - Individual Grupo 1
563,811012172,CONCESION TUNEL ABURRA ORIENTE S.A.,SUPERTRANSPORTE,Antioquia,ANTIOQUIA,MEDELLIN,F4290 - Obras de ingeniería civil,Construccion ,523903344,62340843,1025182128,816168572,209013556,434338364,50539030,965703993,819031280,146672713,GRUPO 1
564,901041691,CENTROS MEDICOS COLSANITAS S.A.S,SUPERSALUD,Bogotá - Cundinamarca,BOGOTA D.C.,"BOGOTA, D.C.",K6494 - Otras actividades de distribución de fondos,Servicios,520911734,4052080,187919000,152851131,35067869,122768407,28754447,82282960,50818507,31464453,GRUPO 1
565,900265170,SOLUCIONES  BOLIVAR S.A.S.,SUPERSOCIEDADES,Bogotá - Cundinamarca,BOGOTA D.C.,"BOGOTA, D.C.","K6499 - Otras actividades de servicio financiero, excepto las de seguros y pensiones n.c.p.",Servicios,520823340,522593526,4000107589,2584580,3997523009,431127168,431021363,3348212438,19744136,3328468302,20 NIIF Plenas - Separado Grupo 1
566,900570964,ULTRACEM SAS,SUPERSOCIEDADES,Costa Atlántica,ATLANTICO,GALAPA,"C2394 - Fabricación de cemento, cal y yeso",Manufactura,520269679,9668050,447336808,232740399,214596409,418164832,11107448,418825653,211020332,207805321,20 NIIF Plenas - Separado Grupo 1
567,860090365,AAK Colombia S.A.S.,SUPERSOCIEDADES,Bogotá - Cundinamarca,BOGOTA D.C.,"BOGOTA, D.C.",C1032 - Elaboración de aceites y grasas de origen vegetal refinados,Manufactura,518340673,2917809,313236975,308523154,4713821,594377600,-700143,297646154,295850142,1796012,10 NIIF Plenas - Individual Grupo 1
568,810003907,INDUSTRIAS LA VICTORIA SAS,SUPERSOCIEDADES,Eje Cafetero,CALDAS,CHINCHINA,"C2023 - Fabricación de jabones y detergentes, preparados para limpiar y pulir; perfumes y preparados de tocador",Manufactura,517230296,62681803,302257623,65706168,236551455,391988192,40013714,222989921,49120269,173869652,40 NIIF Pymes - Individual Grupo 2
569,890110188,INDEPENDENCE DRILLING SA,SUPERSOCIEDADES,Bogotá - Cundinamarca,BOGOTA D.C.,"BOGOTA, D.C.",B0910 - Actividades de apoyo para la extracción de petróleo y de gas natural,Minero,516827619,936900,689221488,481564429,207657059,514023712,-13034849,696525487,489805328,206720159,10 NIIF Plenas - Individual Grupo 1
570,830013774,INDRA COLOMBIA SAS,SUPERSOCIEDADES,Bogotá - Cundinamarca,BOGOTA D.C.,"BOGOTA, D.C.","J6201 - Actividades de desarrollo de sistemas informáticos (planificación, análisis, diseño, programación, pruebas)",Servicios,514831626,124434,250722400,139909704,110812696,498981728,12912265,259934003,149245741,110688262,10 NIIF Plenas - Individual Grupo 1
571,830050346,NESTLE PURINA PET CARE DE COLOMBIA SA ,SUPERSOCIEDADES,Bogotá - Cundinamarca,BOGOTA D.C.,"BOGOTA, D.C.",C1090 - Elaboración de alimentos preparados para animales,Manufactura,514373116,43898169,286813083,212481593,74331490,473226560,53928160,315331303,230698390,84632913,10 NIIF Plenas - Individual Grupo 1
572,901112025,PROYECTOS Y DESARROLLOS VIALES DEL PACIFICO S.A.S,SUPERSOCIEDADES,Bogotá - Cundinamarca,BOGOTA D.C.,"BOGOTA, D.C.",F4210 - Construcción de carreteras y vías de ferrocarril,Construccion ,512358396,267902838,4353250618,1177447947,3175802671,678422080,397673109,4010368362,1183253541,2827114821,20 NIIF Plenas - Separado Grupo 1
573,901613496,PLAN B INVESTMENT SAS,SUPERSOCIEDADES,Costa Atlántica,ATLANTICO,BARRANQUILLA,"G4711 - Comercio al por menor en establecimientos no especializados con surtido compuesto principalmente por alimentos, bebidas (alcohólicas y no alcohólicas) o tabaco",Comercio,511520153,-85467146,670379931,689432602,-19052671,491371,-707197,423975624,374643807,49331817,10 NIIF Plenas - Individual Grupo 1
574,860024586,PAVIMENTOS COLOMBIA SAS,SUPERSOCIEDADES,Bogotá - Cundinamarca,BOGOTA D.C.,"BOGOTA, D.C.",F4210 - Construcción de carreteras y vías de ferrocarril,Construccion ,511441058,52959069,1471190736,931837994,539352742,255665296,39963594,1296204237,770973473,525230764,20 NIIF Plenas - Separado Grupo 1
575,817002510,CARVAJAL PULPA Y PAPEL SAS ZONA FRANCA PERMANENTE ESPECIAL   ,SUPERSOCIEDADES,Costa Pacífica,VALLE DEL CAUCA,YUMBO,C1709 - Fabricación de otros artículos de papel y cartón,Manufactura,511401319,-4710928,106052570,86888761,19163809,510847648,91244828,153245946,41167107,112078839,10 NIIF Plenas - Individual Grupo 1
